{
  "scene_id": "mock_scene",
  "coordinate_system": "y_up",
  "meters_per_unit": 1.0,
  "nodes": [
    {
      "asset_id": "mug_0",
      "semantic": "mug: coffee mug",
      "size": [
        0.08,
        0.08,
        0.1
      ],
      "pose": {
        "position": [
          0.1,
          0.2,
          0.8
        ],
        "orientation": [
          1.0,
          0.0,
          0.0,
          0.0
        ]
      },
      "task_tag": [
        "fill",
        "place",
        "pick"
      ],
      "usd_path": "<USD_SOURCE_DIR>/mug_0.usd",
      "properties": {
        "mass": 0.2,
        "friction": 0.5,
        "restitution": 0.1
      },
      "bp_metadata": {
        "sim_role": "manipulable_object",
        "category": "mug",
        "affordances": [
          "Graspable",
          "Containable"
        ],
        "articulation": {},
        "placement_region": null
      }
    },
    {
      "asset_id": "variation_mug_1",
      "semantic": "mug: variation mug",
      "size": [
        0.1,
        0.1,
        0.1
      ],
      "pose": {
        "position": [
          0.0,
          0.0,
          0.0
        ],
        "orientation": [
          1.0,
          0.0,
          0.0,
          0.0
        ]
      },
      "task_tag": [],
      "usd_path": "<USD_SOURCE_DIR>/variation_mug_1.usd",
      "properties": {
        "mass": 0.5,
        "friction": 0.5,
        "restitution": 0.1
      },
      "bp_metadata": {
        "sim_role": "unknown",
        "category": "mug",
        "affordances": [],
        "articulation": {},
        "placement_region": null
      }
    }
  ],
  "edges": [
    {
      "source": "mug_0",
      "target": "variation_mug_1",
      "relation": "adjacent",
      "confidence": 0.7
    },
    {
      "source": "mug_0",
      "target": "variation_mug_1",
      "relation": "aligned",
      "confidence": 0.6
    }
  ],
  "metadata": {
    "source": "blueprintpipeline",
    "environment_type": "kitchen",
    "room_bounds": {
      "width": 2.0,
      "depth": 2.0,
      "height": 2.0
    }
  }
}